{
  "$schema": "http://json-schema.org/draft-07/schema#",
  "$id": "https://life-systems.local/schemas/StateUpdated_v1.json",
  "title": "StateUpdated",
  "description": "Synthesized state from all advisors, ready for presentation",
  "type": "object",
  "required": ["event_type", "version", "timestamp", "context", "payload"],
  "properties": {
    "event_type": {
      "type": "string",
      "const": "StateUpdated"
    },
    "version": {
      "type": "string",
      "const": "v1"
    },
    "timestamp": {
      "type": "string",
      "format": "date-time"
    },
    "context": {
      "type": "string",
      "const": "SYNTH"
    },
    "payload": {
      "type": "object",
      "required": ["sections", "conflicts", "alerts"],
      "properties": {
        "sections": {
          "type": "object",
          "properties": {
            "career": {"type": "object"},
            "market": {"type": "object"},
            "dating": {"type": "object"},
            "relocation": {"type": "object"}
          }
        },
        "conflicts": {
          "type": "array",
          "items": {
            "type": "object",
            "required": ["conflict_type", "advisors", "summary", "perspectives"],
            "properties": {
              "conflict_type": {"type": "string", "enum": ["advisor_disagreement", "goal_conflict"]},
              "advisors": {"type": "array", "items": {"type": "string"}},
              "summary": {"type": "string"},
              "perspectives": {
                "type": "array",
                "items": {
                  "type": "object",
                  "required": ["advisor", "recommendation", "confidence"],
                  "properties": {
                    "advisor": {"type": "string"},
                    "recommendation": {"type": "string"},
                    "confidence": {"type": "number", "minimum": 0, "maximum": 1}
                  }
                }
              }
            }
          }
        },
        "alerts": {
          "type": "array",
          "items": {
            "type": "object",
            "required": ["alert_type", "severity", "message"],
            "properties": {
              "alert_type": {"type": "string", "enum": ["threshold_breach", "trend_change", "conflict"]},
              "severity": {"type": "string", "enum": ["info", "warning", "critical"]},
              "message": {"type": "string"},
              "context_data": {"type": "object"}
            }
          }
        }
      }
    }
  }
}
